<?xml version="1.0" encoding="UTF-8"?>
<pageDefinition  xmlns:xsi="http://www.w3.org/2001/XMLSchema-instance" xsi:noNamespaceSchemaLocation="../../../core/query/xml/definition/pageDefinition.xsd">
	<queryDefinition>
		<mappedClass mappedClass="com.frame.core.entity.RoleEntity"
			alias="r" >
		</mappedClass>
		<where></where>
		<sort>
			<by field="id" fromAlias="r" order="ASC"></by>
		</sort>
		<columns>
			<column header="id" field="id" fromAlias="r" width="20%" sortable="true" hidden="false"></column>
			<column header="编码" field="code" fromAlias="r" width="40%" sortable="true" hidden="false"></column>
			<column header="名称" field="name" fromAlias="r" width="40%" sortable="true" hidden="false"></column>
		</columns>
		<searchDefinition>
			<condition alias="r" field="code" operator="LIKE" displayText="编码" inputType="TEXT"></condition>
			<condition alias="r" field="name" operator="LIKE" displayText="名称" inputType="TEXT"></condition>
		</searchDefinition>
		<pageSize>10</pageSize>
	</queryDefinition>
	<manage beforeManage="beforeUpdate">
		<field field="code" displayText="编码"></field>
		<field field="name" displayText="名称"></field>
		<field field="description" displayText="描述" inputType="TEXTAREA"></field>
		<js>
			<path>/resources/js/roleMenu/roleMenuManage.js</path>
			<path>/resources/ztree/js/jquery.ztree.all.js</path>
		</js>
		<css>
			<path>/resources/css/roleMenu/roleMenuManage.css</path>
			<path>/resources/ztree/css/metroStyle/metroStyle.css</path>
		</css>
	</manage>
	<delete beforeDelete="beforeDelete"></delete>
</pageDefinition>