<?xml version="1.0" encoding="UTF-8"?>
<pageDefinition  xmlns:xsi="http://www.w3.org/2001/XMLSchema-instance"
				 xsi:noNamespaceSchemaLocation="/pageDefinition.xsd">
	<queryDefinition>
		<mappedClass mappedClass="com.frame.schedule.entity.TaskEntity">
		</mappedClass>
		<where>taskType='STATIC'</where>
		<sort>
			<by field="id" order="ASC"/>
		</sort>
		<columns>
			<column header="Id" field="id" width="10%" sortable="true" hidden="false"/>
			<column header="任务编码" field="taskCode" width="10%" sortable="true" hidden="false"/>
			<column header="任务名称" field="taskName" sortable="true" hidden="false"/>
			<column header="任务标签" field="taskTag " sortable="true" hidden="false"/>
			<column header="任务执行周期" field="taskCron" sortable="true" hidden="false"/>
			<column header="执行次数" field="execNum" sortable="true" hidden="false"/>
			<column header="状态" field="status" sortable="true" hidden="false"/>
		</columns>
		<searchDefinition>
			<condition field="taskCode" operator="LIKE" displayText="任务编码" inputType="TEXT"/>
			<condition field="taskName" operator="LIKE" displayText="任务名称" inputType="TEXT"/>
		</searchDefinition>
		<pageSize>10</pageSize>
        <js>
            <path>/resources/js/schedule/task-list.js</path>
        </js>
        <css>
        </css>
	</queryDefinition>
	<delete></delete>
	<manage>
		<field field="taskName" displayText="任务名称"/>
		<field field="taskTag" displayText="任务标签"/>
		<field field="taskCode" displayText="任务编码"/>
		<field field="taskCron" displayText="任务执行周期"/>
		<field field="paramTemplate" displayText="任务参数模板" inputType="TEXTAREA"/>
	</manage>
</pageDefinition>