<?xml version="1.0" encoding="UTF-8"?>
<pageDefinition  xmlns:xsi="http://www.w3.org/2001/XMLSchema-instance" xsi:noNamespaceSchemaLocation="../../../core/query/xml/definition/pageDefinition.xsd">
	<queryDefinition showIndex="序号">
		<mappedClass mappedClass="com.frame.demo.entity.Student">
		</mappedClass>
		<where></where>
		<sort>
			<by field="id" order="ASC"></by>
		</sort>
		<columns>
			<column header="ID" field="id"  width="10%" sortable="true" hidden="false"></column>
			<column header="姓名" field="name" sortable="true" hidden="false"></column>
			<column header="学号" field="no" sortable="true" hidden="false"></column>
		</columns>
		<searchDefinition>
			<condition field="name" operator="LIKE" displayText="姓名" inputType="TEXT"></condition>
			<condition field="no" operator="=" displayText="学号" inputType="TEXT"></condition>
		</searchDefinition>
		<pageSize>10</pageSize>
	</queryDefinition>
	<delete></delete>
	<manage>
		<field field="name" displayText="姓名"></field>
		<field field="no" displayText="学号"></field>
	</manage>
</pageDefinition>